[
    {
        "name": "The Thing",
        "alienValidated": true,
        "addedDate": "2024-09-23",
        "creatorObj": {
            "creators": "John Carpenter, Bill Lancaster",
            "validated": true,
            "validatedDate": "2024-09-23"
        },
        "summaryObj": {
            "summary": "A shape-shifting extraterrestrial organism that infiltrates an Antarctic research station, mimicking its human hosts and creating paranoia and terror among the survivors.",
            "validated": true,
            "validatedDate": "2024-09-23"
        },
        "imagesArray": [
            {
                "imageObj": {
                    "addSequence": 0,
                    "imageSrc": "./images/TheThing.png",
                    "validated": true,
                    "validatedDate": "2024-09-23",
                    "issuesReportedArray": [
                        {
                            "issue": "The image is incorrect.",
                            "reportedBy": "User123",
                            "reportedDate": "2024-09-23"
                        },
                        {
                            "issue": "The image is too small.",
                            "reportedBy": "User456",
                            "reportedDate": "2024-09-23"
                        }
                    ]
                }
            },
            {
                "imageObj": {
                    "addSequence": 1,
                    "imageSrc": "./images/TheThing.png",
                    "validated": true,
                    "validatedDate": "2024-09-23",
                    "issuesReportedArray": [
                        {
                            "issueObj": {
                                "addSequence": 0,
                                "issue": "The image is incorrect.",
                                "reportedBy": "User123",
                                "reportedDate": "2024-09-23"
                            }
                        },
                        {
                            "issueObj": {
                                "addSequence": 1,
                                "issue": "The image is too small.",
                                "reportedBy": "User456",
                                "reportedDate": "2024-09-23"
                            }
                        }
                    ]
                }
            }
        ]
    }
]